{
  "schema_version": "repo-assessment.v1",
  "assessment_id": "assess-example-not-git-repo-blocked",
  "observation_ref": "obs-example-not-git-repo",
  "derived_status": [
    "not_git_repo"
  ],
  "source_refs": [
    "git.rev_parse.worktree",
    "local_config.canonical_repo_roots",
    "local_config.excluded_repo_roots",
    "filesystem.path"
  ],
  "decision_state": "action_blocked",
  "risk_level": "medium",
  "skip_reasons": [
    "not_git_repo"
  ],
  "confidence": 1.0,
  "missing_evidence": [],
  "rule_refs": [
    "assessment.rule.not_git_repo_blocks_action"
  ],
  "freshness_refs": [
    "freshness.local_git_probe.current_invocation"
  ],
  "falsification_refs": []
}
